{
  "plugin_schema_version": "1.0.0",
  "question_id": "Plane111",
  "category": "C",
  "operation": "C_manual",
  "description": "missed-crossing-2",
  "intent": "Visual induction toward 4; user-requested unreviewed staged candidate",
  "params": {
    "actions": [
      {
        "type": "add_point",
        "xy": [
          -1.7478381048599623,
          -0.08695952621499062
        ],
        "color": "#EA580C",
        "id": "author_batch_1",
        "filled": true,
        "size_pt2": 50,
        "edge_linewidth_pt": 1.0
      },
      {
        "type": "add_point",
        "xy": [
          -0.47368421052631593,
          0.231578947368421
        ],
        "color": "#EA580C",
        "id": "author_batch_2",
        "filled": true,
        "size_pt2": 50,
        "edge_linewidth_pt": 1.0
      },
      {
        "type": "add_point",
        "xy": [
          1.3851042190181628,
          -1.0695729533127138
        ],
        "color": "#EA580C",
        "id": "author_batch_3",
        "filled": true,
        "size_pt2": 50,
        "edge_linewidth_pt": 1.0
      },
      {
        "type": "add_point",
        "xy": [
          1.5831322225070208,
          0.7457830556267552
        ],
        "color": "#EA580C",
        "id": "author_batch_4",
        "filled": true,
        "size_pt2": 50,
        "edge_linewidth_pt": 1.0
      }
    ]
  }
}
