{
  "plugin_schema_version": "1.0.0",
  "question_id": "Plane120",
  "category": "C",
  "operation": "C_manual",
  "description": "add-false-turn-4",
  "intent": "Visual induction toward 6; user-requested unreviewed staged candidate",
  "params": {
    "actions": [
      {
        "type": "add_point",
        "xy": [
          -2.8,
          -0.3
        ],
        "color": "#16A34A",
        "id": "author_batch_1",
        "filled": true,
        "size_pt2": 50,
        "edge_linewidth_pt": 1.0
      },
      {
        "type": "add_point",
        "xy": [
          -0.8,
          -0.3
        ],
        "color": "#16A34A",
        "id": "author_batch_2",
        "filled": true,
        "size_pt2": 50,
        "edge_linewidth_pt": 1.0
      },
      {
        "type": "add_point",
        "xy": [
          0.2,
          1.6
        ],
        "color": "#16A34A",
        "id": "author_batch_3",
        "filled": true,
        "size_pt2": 50,
        "edge_linewidth_pt": 1.0
      },
      {
        "type": "add_point",
        "xy": [
          2.1,
          1.6
        ],
        "color": "#16A34A",
        "id": "author_batch_4",
        "filled": true,
        "size_pt2": 50,
        "edge_linewidth_pt": 1.0
      },
      {
        "type": "add_point",
        "xy": [
          2.1,
          -0.9
        ],
        "color": "#16A34A",
        "id": "author_batch_5",
        "filled": true,
        "size_pt2": 50,
        "edge_linewidth_pt": 1.0
      },
      {
        "type": "add_point",
        "xy": [
          1.1500000000000001,
          1.6
        ],
        "color": "#16A34A",
        "id": "author_batch_6",
        "filled": true,
        "size_pt2": 50,
        "edge_linewidth_pt": 1.0
      }
    ]
  }
}
